<?xml version="1.0" encoding="UTF-8" ?>
<!DOCTYPE photo SYSTEM "photo.dtd">

<photo>
   <type>hd</type>
   <creator>shoultz</creator>
   <mimetype>text/html</mimetype>
   <location>https://pixabay.com/photos/keyboard-computer-keys-white-886462/ (Links to an external site.)</location>
   <keywords>
      <keyword>color</keyword>
      <keyword>asdfasdf</keyword>
   </keywords>
</photo>
