<?xml version="1.0" encoding="UTF-8" ?>
<!DOCTYPE photo SYSTEM "photo.dtd">

<photo>
   <type>stock</type>
   <creator>Simon</creator>
   <mimetype>text/html</mimetype>
   <location>https://pixabay.com/photos/keyboard-computer-keys-white-886462/ (Links to an external site.)</location>
   <keywords>
      <keyword>blackandwhite</keyword>
      <keyword>keyboard</keyword>
   </keywords>
</photo>
